date	time	ticker	name	title	summary	link
2021-01-14	2021-01-14 16:40:04	ECL	Ecolab Inc.	CE vs. ECL: Which Stock Is the Better Value Option?	CE vs. ECL: Which Stock Is the Better Value Option?	https://finance.yahoo.com/news/ce-vs-ecl-stock-better-164004990.html?.tsrc=rss
2021-01-13	2021-01-13 12:28:00	ECL	Ecolab Inc.	Is Ecolab Stock a Buy?	Analyzing the investment case for a company that is both a beneficiary and a victim of the coronavirus pandemic.	https://finance.yahoo.com/m/1c677239-e514-334f-bc82-a187213e1f79/is-ecolab-stock-a-buy%3F.html?.tsrc=rss
2021-01-11	2021-01-11 21:30:00	ECL	Ecolab Inc.	Ecolab Schedules Webcast and Conference Call on February 16	Ecolab will host a live webcast of its fourth quarter earnings conference call to discuss 2020 fourth quarter results. A news release containing fourth quarter results is expected to be issued before market open on February 16, 2021.	https://finance.yahoo.com/news/ecolab-schedules-webcast-conference-call-213000688.html?.tsrc=rss
2021-01-06	2021-01-06 16:56:46	ECL	Ecolab Inc.	Basic Materials Sector Looks Set to Head Higher	Nearby support levels and strong price action suggest that the basic materials sector could be one to watch over the weeks and months ahead.	https://finance.yahoo.com/m/96fc1f6b-561b-3a80-8c93-af31c2cfbfba/basic-materials-sector-looks.html?.tsrc=rss
2020-12-29	2020-12-29 16:40:04	ECL	Ecolab Inc.	WLKP vs. ECL: Which Stock Should Value Investors Buy Now?	WLKP vs. ECL: Which Stock Is the Better Value Option?	https://finance.yahoo.com/news/wlkp-vs-ecl-stock-value-164004176.html?.tsrc=rss
2020-12-27	2020-12-27 12:43:00	ECL	Ecolab Inc.	3 Top Stocks That Aren't On Wall Street's Radar	If your stock picks are largely limited to the names you hear about in the news, you may be doing yourself a disservice.  To this end, anyone looking for an undervalued, overlooked name to add to their portfolio may want to consider StoneCo Ltd (NASDAQ: STNE), Sociedad Quimica y Minera de Chile S.A. (NYSE: SQM), and Ecolab (NYSE: ECL).  None of them are complete unknowns, but Wall Street hasn't yet told the entirety of their stories to the investor community.	https://finance.yahoo.com/m/4d041573-412f-3427-aeb8-c982fb2bcc0e/3-top-stocks-that-aren%27t-on.html?.tsrc=rss
2020-12-18	2020-12-18 13:30:00	ECL	Ecolab Inc.	FDA Authorizes Ecolab’s Bioquell Technology System for N95 Respirator Decontamination	Ecolab Inc., the global leader in water, hygiene and infection prevention solutions and services that protect people and vital resources, has received Emergency Use Authorization (EUA) from the U.S. Food and Drug Administration (FDA) for its Bioquell Technology System to decontaminate specific N95 respirators.1 The EUA is for Ecolab’s Bioquell BQ-50 and Bioquell ProteQ decontamination systems and enables healthcare facilities to decontaminate respirators on-site to help address continuing respirator shortages.	https://finance.yahoo.com/news/fda-authorizes-ecolab-bioquell-technology-133000331.html?.tsrc=rss
2020-12-14	2020-12-14 06:47:35	ECL	Ecolab Inc.	Barclays Says These Cleaning and Sanitation Stocks Will Shine Even After Pandemic	"Barclays analyst Lauren Liebermann expects cleaning and sanitation companies to remain long-term beneficiaries of the COVID-19 pandemic.What Happened: ""Pre-pandemic, sanitization/cleaning was mostly taken for granted, but in a post-pandemic world we believe consumers and employees will demand that places not only 'be clean' but also 'show clean,'"" Liebermann said in a note, as first reported by CNBC.The Barclays analyst sees larger incumbents and well-known consumer brands benefiting in particular as she foresees ""a greatly expanding addressable market as well as share consolidation"" in the $30 billion industry.The Barclays analyst estimates a 10% to 20% uptick in same-store sales compared to the pre-coronavirus period for cleaning and sanitation companies and lists the following stocks as the ones particularly to watch, CNBC noted.Ecolab Inc (NYSE: ECL): With an estimated market share between 12% to 16%, Liebermann expects the company to target a 20% hike in penetration rate among its current customers. Since the beginning of the year, Ecolab stock has risen merely by 14.6%. Based on the company's operational scale, service, innovation, and technological abilities, the Barclays analyst predicts a consolidation.Ecolab shares last closed 0.8% lower at $221.25 on Friday.Cintas Corporation (NASDAQ: CTAS) Liebermann pointed out that although primarily in the business of uniform rentals, the company's revenues from its sanitization and hygiene facility service offering contributes almost 10% to the total revenue.Cintas shares closed 0.5% higher at $349.11 on Friday.Proctor & Gamble Co (NYSE: PG): Liebermann notes that the consumer goods company has booked a systematic growth from its cleaning solutions segment, P&G Professional. ""Post-pandemic P&G Professional should be nicely placed to continue gaining share,"" the analyst said, as per CNBC.PG shares last closed 0.74% higher at $136.51.Clorox Co (NYSE: CLX): The company's Professional Products Segment, including the Clorox Pro, could be one of the growth drivers, as per Liebermann. Stock is up 30% driven by higher demand for bleach and disinfectant wipes. The Barclays analysts forecast this segment to be one of the ""compelling growth opportunities"" for the company.Clorox shares were up 0.56% at $201.73 on last close.Reckitt Benckiser Group PLC - ADR (OTC: RBGLY): In July, Reuters reported that the British consumer goods company partnered into long term contracts with multiple companies. The analyst anticipates selected and sizeable contracts to boost sales volumes.RBGLY shares closed 0.1% lower at $17.78 on Friday.Aramark Corporation (NYSE: ARMK): Aramark's core business is in the food delivery market but the company also holds growth prospects in the facilities management business, according to Liebermann.Aramark shares closed 1.2% lower at $37.60 on Friday.See Also: Analyst Recommends These ETFs To Play 3 Key Themes For 2021 -- EVs, Cannabis, And COVID-19 RecoveryLatest Ratings for CTAS  DateFirmActionFromTo  Oct 2020Morgan StanleyMaintainsUnderweight  Oct 2020JefferiesMaintainsBuy  Oct 2020Argus ResearchInitiates Coverage OnBuy    View More Analyst Ratings for CTAS   View the Latest Analyst RatingsSee more from Benzinga  * Click here for options trades from Benzinga  * Microsoft's Cloud Products Are Attracting New Customers(C) 2020 Benzinga.com. Benzinga does not provide investment advice. All rights reserved."	https://finance.yahoo.com/news/barclays-says-cleaning-sanitation-stocks-064735988.html?.tsrc=rss
2020-12-10	2020-12-10 16:40:04	ECL	Ecolab Inc.	WLKP or ECL: Which Is the Better Value Stock Right Now?	WLKP vs. ECL: Which Stock Is the Better Value Option?	https://finance.yahoo.com/news/wlkp-ecl-better-value-stock-164004084.html?.tsrc=rss
2020-12-10	2020-12-10 04:56:07	ECL	Ecolab Inc.	Ecolab Inc. (NYSE:ECL) Looks Interesting, And It's About To Pay A Dividend	Ecolab Inc. ( NYSE:ECL ) stock is about to trade ex-dividend in 3 days. This means that investors who purchase shares...	https://finance.yahoo.com/news/ecolab-inc-nyse-ecl-looks-045607758.html?.tsrc=rss
2020-12-09	2020-12-09 13:30:00	ECL	Ecolab Inc.	Ecolab One of Elite Group of Companies Named to Both CDP Climate and Water Security A Lists	Ecolab Inc., the global leader in water, hygiene and infection prevention solutions and services that protect people and vital resources, has been recognized for its sustainability leadership by global environmental non-profit CDP, securing a place on its prestigious ‘A List’ for tackling climate change and protecting water security.	https://finance.yahoo.com/news/ecolab-one-elite-group-companies-133000446.html?.tsrc=rss
2020-12-08	2020-12-08 19:35:00	ECL	Ecolab Inc.	Cleaning Will Remain Crucial Post-Covid. Here Are the Stocks That Will Benefit.	Barclays argues that the trend won’t fade even when the pandemic does, and a fragmented market presents big opportunities for household cleaning brands to make inroads with corporate clients.  Analyst Lauren Lieberman takes a look at the commercial cleaning market, and argues that even after Covid-19 is no longer a major risk, consumers of all kinds will want to see evidence of cleanliness—rather than just assuming it has taken place.  Of course, businesses were already doing plenty of cleaning pre-Covid, although companies that have a longer history in industrial cleaning, like  (ECL) (ticker: ECL) may not ring a bell with consumers, who are more used to household names like  (CLX) (CLX).	https://finance.yahoo.com/m/ed2be6d8-7037-3ee8-99d4-0d27405a8781/cleaning-will-remain-crucial.html?.tsrc=rss
2020-12-08	2020-12-08 17:55:47	ECL	Ecolab Inc.	Is ECL A Good Stock To Buy Now?	At the end of February we announced the arrival of the first US recession since 2009 and we predicted that the market will decline by at least 20% in (Recession is Imminent: We Need A Travel Ban NOW). In these volatile markets we scrutinize hedge fund filings to get a reading on which direction each […]	https://finance.yahoo.com/news/ecl-good-stock-buy-now-184147795.html?.tsrc=rss
2020-12-05	2020-12-05 12:30:00	ECL	Ecolab Inc.	Stryker, Ecolab, Eastman Chemical, and Nucor Plan to Boost Dividends	Microsoft, Verizon Communications, Deere, and Mondelez International were among the companies that said they will keep their quarterly payouts at current levels.	https://finance.yahoo.com/m/ff4a3468-3b76-30de-924d-0b2081a18093/stryker%2C-ecolab%2C-eastman.html?.tsrc=rss
2020-12-03	2020-12-03 22:33:00	ECL	Ecolab Inc.	CORRECTING and REPLACING Ecolab Increases Cash Dividend 2%	First paragraph, first sentence of release should read: The Board of Directors of Ecolab Inc. declared a 2% increase in the company’s quarterly cash dividend to $0.48 per common share, to be paid January 15, 2021, to shareholders of record at the close of business on December 15, 2020. (instead of The Board of Directors of Ecolab Inc. declared a 2% increase in the company’s quarterly cash dividend to $0.48 per common share, to be paid January 15, 2020, to shareholders of record at the close of business on December 15, 2020.).	https://finance.yahoo.com/news/ecolab-increases-cash-dividend-2-213000320.html?.tsrc=rss
2020-12-02	2020-12-02 21:30:00	ECL	Ecolab Inc.	Ecolab Schedules Webcast of Industry Conference for December 9, 2020	Ecolab Inc. CFO Daniel J. Schmechel will address financial analysts virtually at the BMO Growth and ESG Conference on Wednesday, December 2. Ecolab will offer a live webcast of Mr. Schmechel’s presentation. Details for the webcast are as follows:	https://finance.yahoo.com/news/ecolab-schedules-webcast-industry-conference-213000489.html?.tsrc=rss
2020-11-30	2020-11-30 15:00:00	ECL	Ecolab Inc.	Ecolab Schedules ESG Webcast for December 7, 2020	Ecolab Inc. President and COO Christophe Beck will lead a discussion for investors regarding Ecolab’s ESG approach and strategy on Monday, December 7. Ecolab will offer a live webcast of the event; details are as follows:	https://finance.yahoo.com/news/ecolab-schedules-esg-webcast-december-150000922.html?.tsrc=rss
2020-11-26	2020-11-26 16:14:29	ECL	Ecolab Inc.	Cleaning up: COVID-19 vaccine will not derail disinfectants market, industry exec says	"Ecolab has supplied Oxford's vaccine-makers, supermarkets such as Tesco and England's National Health Service (NHS) with products during the pandemic this year, and supplies three million commercial sites globally.  In the summer, it signed a deal with the NHS to supply 5 million litres of hand sanitiser, which Sam De Boo, Ecolab's President for Western Europe, said was the firm's biggest one-time customer order.  ""It will of course go down from these current peak levels (but) we do believe it will be higher than 2019,"" De Boo told Reuters on Thursday."	https://finance.yahoo.com/news/cleaning-covid-19-vaccine-not-161429598.html?.tsrc=rss
2020-11-24	2020-11-24 20:00:00	ECL	Ecolab Inc.	Ecolab Names Chris Roberts Executive Vice President and General Manager of Global Food and Beverage	Ecolab Inc. today announced that Chris Roberts has been appointed executive vice president and general manager, Global Food & Beverage.	https://finance.yahoo.com/news/ecolab-names-chris-roberts-executive-200000861.html?.tsrc=rss
2020-11-24	2020-11-24 16:40:04	ECL	Ecolab Inc.	WLKP or ECL: Which Is the Better Value Stock Right Now?	WLKP vs. ECL: Which Stock Is the Better Value Option?	https://finance.yahoo.com/news/wlkp-ecl-better-value-stock-164004478.html?.tsrc=rss
2020-11-24	2020-11-24 11:07:11	ECL	Ecolab Inc.	Ecolab (ECL) Gets EPA Nod for Biofilm Disinfectant Virasept	Ecolab's (ECL) Virasept has been developed to combat bacterial growth in hospitals.	https://finance.yahoo.com/news/ecolab-ecl-gets-epa-nod-110711600.html?.tsrc=rss
2020-11-20	2020-11-20 22:13:00	ECL	Ecolab Inc.	5 Stocks That Will Press On	Discover five great companies with decades of success behind them and opportunities in front.	https://finance.yahoo.com/m/bb8de1dd-58f5-3ce3-94aa-a27d513a9608/5-stocks-that-will-press-on.html?.tsrc=rss
2020-11-19	2020-11-19 13:40:00	ECL	Ecolab Inc.	Ecolab Receives First EPA Approval for Biofilm Disinfection in Drains	Ecolab Inc., the global leader in water, hygiene and infection prevention solutions and services, is the first to receive EPA product approval for disinfection of biofilmsi in wastewater drains for its Virasept™ product – an important part of a comprehensive environmental hygiene program designed to help effectively combat bacterial growth in hospitals.	https://finance.yahoo.com/news/ecolab-receives-first-epa-approval-134000547.html?.tsrc=rss
2020-11-19	2020-11-19 11:10:06	ECL	Ecolab Inc.	Kersia International SAS -- Moody's assigns B3 rating to Kersia, positive outlook	"Moody's Investors Service, (""Moody's"") has today assigned a B3 corporate family rating (CFR) and a B3-PD probability of default rating (PDR) to Kersia International SAS (Kersia).  Moody's has also assigned a B3 instrument rating to the proposed E350 million senior secured term loan B including its delayed draw term facility of E70 million and the proposed E100 million senior secured revolving credit facility, all of these instruments are borrowed by Kersia International SAS."	https://finance.yahoo.com/m/c36c18d0-49cc-3b32-a271-e71939ed2986/kersia-international-sas-.html?.tsrc=rss
2020-11-18	2020-11-18 13:33:00	ECL	Ecolab Inc.	Ecolab Named to Dow Jones Sustainability World Index	Ecolab Inc., the global leader in water, hygiene and infection prevention solutions and services that protect people and vital resources, has been named to the Dow Jones Sustainability™ World Index (DJSI World), which tracks the leading sustainability-driven publicly listed companies globally.	https://finance.yahoo.com/news/ecolab-named-dow-jones-sustainability-133300067.html?.tsrc=rss
2020-11-16	2020-11-16 12:43:12	ECL	Ecolab Inc.	Ecolab Introduces Exelerate TUFSOIL for Food Manufacturers	Ecolab's (ECL) Exelerate TUFSOIL has been developed to increase production time and enhance cleaning outcomes to curb food safety risks and improve worker safety.	https://finance.yahoo.com/news/ecolab-introduces-exelerate-tufsoil-food-124312302.html?.tsrc=rss
2020-11-14	2020-11-14 13:05:55	ECL	Ecolab Inc.	Should You Be Excited About Ecolab Inc.'s (NYSE:ECL) 20% Return On Equity?	Many investors are still learning about the various metrics that can be useful when analysing a stock. This article is...	https://finance.yahoo.com/news/excited-ecolab-inc-nyse-ecl-130555516.html?.tsrc=rss
2020-11-12	2020-11-12 13:30:00	ECL	Ecolab Inc.	Ecolab’s New Exelerate™ TUFSOIL Cleaner and Degreaser Helps Minimize the Time Needed to Remove Tough, Burnt-on Soils	Ecolab, the global leader in water, hygiene and infection prevention solutions and services, has launched Exelerate™ TUFSOIL, an innovative ready-to-use gel cleaner and degreaser for food and protein manufacturers. Exelerate TUFSOIL helps enable more effective cleaning while minimizing time spent removing tough, burnt-on soils in fryers, ovens, smokehouses, dryers, racks, catwalks and environmental areas.	https://finance.yahoo.com/news/ecolab-exelerate-tufsoil-cleaner-degreaser-133000570.html?.tsrc=rss
2020-11-06	2020-11-06 16:40:04	ECL	Ecolab Inc.	WLKP vs. ECL: Which Stock Should Value Investors Buy Now?	WLKP vs. ECL: Which Stock Is the Better Value Option?	https://finance.yahoo.com/news/wlkp-vs-ecl-stock-value-164004804.html?.tsrc=rss
2020-11-03	2020-11-03 21:30:00	ECL	Ecolab Inc.	Ecolab Schedules Webcast of Industry Conference for November 10, 2020	Ecolab Inc. President and COO Christophe Beck will address financial analysts virtually at the Baird Global Industrial Conference on Tuesday, November 10. Ecolab will offer a live webcast of Mr. Beck’s presentation. Details for the webcast are as follows:	https://finance.yahoo.com/news/ecolab-schedules-webcast-industry-conference-213000525.html?.tsrc=rss
2020-10-30	2020-10-30 12:30:00	ECL	Ecolab Inc.	Ecolab No-Rinse Sanitizer Kills COVID-19 Virus Faster Than Any Other Product	Ecolab, the global leader in water, hygiene and infection prevention solutions and services, received approval from the U.S. Environmental Protection Agency (EPA) for its Sink & Surface Cleaner Sanitizer. The product is the first registered by the EPA to kill the virus that causes COVID-19 in 15 seconds – the fastest product available.	https://finance.yahoo.com/news/ecolab-no-rinse-sanitizer-kills-123000876.html?.tsrc=rss
2020-10-29	2020-10-29 23:25:11	ECL	Ecolab Inc.	Analyst Report: Ecolab Inc.	Ecolab produces and markets cleaning and sanitation products for the hospitality, healthcare, and industrial markets. The firm is the global market share leader in this category with a wide array of products and services, including dish and laundry washing systems, pest control, and infection control products. The company has a strong hold on the U.S. market and is looking to increase its profitability abroad. Additionally, Ecolab serves customers in water and energy end markets, selling customized solutions.	https://finance.yahoo.com/m/2c20a4e0-6b56-3a12-9e57-3e663cfd71e9/analyst-report%3A-ecolab-inc..html?.tsrc=rss
2020-10-29	2020-10-29 21:00:00	ECL	Ecolab Inc.	Christophe Beck to Succeed Doug Baker, Who Is Retiring as Ecolab CEO; Baker to Remain Board Chair	Ecolab Inc. announced that Christophe Beck, currently Ecolab’s president and chief operating officer, will succeed Douglas Baker, Jr. as the company’s chief executive officer effective January 1, 2021, becoming president and chief executive officer. Beck also has been elected to Ecolab’s board of directors.	https://finance.yahoo.com/news/christophe-beck-succeed-doug-baker-210000826.html?.tsrc=rss
2020-10-29	2020-10-29 15:25:04	ECL	Ecolab Inc.	Were Hedge Funds Right About Ecolab Inc. (ECL)?	In this article you are going to find out whether hedge funds think Ecolab Inc. (NYSE:ECL) is a good investment right now. We like to check what the smart money thinks first before doing extensive research on a given stock. Although there have been several high profile failed hedge fund picks, the consensus picks among […]	https://finance.yahoo.com/news/were-hedge-funds-ecolab-inc-152504078.html?.tsrc=rss
2020-10-28	2020-10-28 13:11:48	ECL	Ecolab Inc.	Analyst Report: Ecolab, Inc.	Ecolab is a provider of water, hygiene, and energy technology and services. The company delivers comprehensive solutions to promote safe food, maintain clean environments, optimize water and energy use, and improve operational efficiency for customers in the food, healthcare, energy, hospitality, and industrial sectors. Ecolab has 45,000 employees worldwide.	https://finance.yahoo.com/m/b6d58427-352d-3103-8bed-ab704978269d/analyst-report%3A-ecolab%2C-inc..html?.tsrc=rss
2020-10-28	2020-10-28 12:56:48	ECL	Ecolab Inc.	Market Update: CAT, ECL, MKTX, SWK, TSCO, MA, QSR	Stocks fell sharply on Wednesday morning amid rising coronavirus cases in the U.S. and Europe and mixed corporate earnings. MasterCard shares fell 7% after the company posted 3Q earnings that were down from the prior year and below the consensus estimate, reflecting the slowdown in travel spending. UPS shares also fell sharply despite better-than-expected third-quarter results Amid the selloff, GE posted a surprise 3Q profit and positive free cash flow, sending the shares up nearly 8%. The Dow fell 3.2%, the S&P 3.1%, and the Nasdaq 3.2%. Crude oil traded near $37 per barrel, while gold fell $34 to $1878 per ounce.	https://finance.yahoo.com/m/cef5337b-4cb9-388b-a5c9-a292c7935708/market-update%3A-cat%2C-ecl%2C.html?.tsrc=rss
2020-10-27	2020-10-27 22:00:53	ECL	Ecolab Inc.	Ecolab Inc (ECL) Q3 2020 Earnings Call Transcript	With me today is Doug Baker, Ecolab's Chairman and CEO; Christophe Beck, our President and Chief Operating Officer; and Dan Schmechel, our Chief Financial Officer.  A discussion of our results, along with earnings release and the slides referencing the quarter's results and our outlook, are available on Ecolab's website at ecolab.com/investor.	https://finance.yahoo.com/m/c6452ce2-6f0f-3b32-aa9e-b902d4f2098e/ecolab-inc-%28ecl%29-q3-2020.html?.tsrc=rss
2020-10-27	2020-10-27 19:44:52	ECL	Ecolab Inc.	Analyst Report: Ecolab Inc.	Ecolab produces and markets cleaning and sanitation products for the hospitality, healthcare, and industrial markets. The firm is the global market share leader in this category with a wide array of products and services, including dish and laundry washing systems, pest control, and infection control products. The company has a strong hold on the U.S. market and is looking to increase its profitability abroad. Additionally, Ecolab serves customers in water and energy end markets, selling customized solutions.	https://finance.yahoo.com/m/87b3eff6-c6cc-3478-9a43-3176d8aa245c/analyst-report%3A-ecolab-inc..html?.tsrc=rss
2020-10-27	2020-10-27 14:34:02	ECL	Ecolab Inc.	Ecolab (ECL) Earnings and Revenues Surpass Estimates in Q3	Although Ecolab's (ECL) third-quarter results reflect weakness in the Global Industrial and Institutional segments, its Global Healthcare and Life Sciences unit shows strength.	https://finance.yahoo.com/news/ecolab-ecl-earnings-revenues-surpass-143402977.html?.tsrc=rss
2020-10-27	2020-10-27 14:25:02	ECL	Ecolab Inc.	Ecolab (ECL) Q3 Earnings and Revenues Surpass Estimates	Ecolab (ECL) delivered earnings and revenue surprises of 5.50% and 1.49%, respectively, for the quarter ended September 2020. Do the numbers hold clues to what lies ahead for the stock?	https://finance.yahoo.com/news/ecolab-ecl-q3-earnings-revenues-142502433.html?.tsrc=rss
2020-10-27	2020-10-27 12:30:00	ECL	Ecolab Inc.	Ecolab Third Quarter Reported Diluted Continuing Operations EPS $0.85; Adjusted Diluted Continuing Operations EPS $1.15, -24%; Results Show Significant Improvement From Second Quarter	Ecolab Inc. (NYSE: ECL):	https://finance.yahoo.com/news/ecolab-third-quarter-reported-diluted-123000536.html?.tsrc=rss
2020-10-21	2020-10-21 15:40:03	ECL	Ecolab Inc.	ETFs to Watch on Likely Q3 Earnings Surprise for Materials	With positive earnings estimate revision and earnings surprises in the cards, materials ETFs might continue to see smooth trading in the weeks ahead.	https://finance.yahoo.com/news/etfs-watch-likely-q3-earnings-154003776.html?.tsrc=rss
2020-10-21	2020-10-21 13:07:01	ECL	Ecolab Inc.	Ecolab (ECL) to Report Q3 Earnings: What's in the Offing?	Ecolab's (ECL) Global Industrial segment is likely to have gained from the Water, Food & Beverage and Life Sciences sub-units in Q3.	https://finance.yahoo.com/news/ecolab-ecl-report-q3-earnings-130701757.html?.tsrc=rss
2020-10-21	2020-10-21 12:30:00	ECL	Ecolab Inc.	Ecolab Partners With Water.org to Improve Access to Clean, Safe, Sustainable Water	One in nine people around the world currently lack access to clean water. As communities grapple with the impacts of climate change, economic recessions and public health crises, the need for access to clean, safe water is more crucial than ever. On the sixth annual Imagine a Day Without Water, Ecolab is announcing a partnership with Water.org to help enable access to sustainable water and improved sanitation in at-risk watersheds in India.	https://finance.yahoo.com/news/ecolab-partners-water-org-improve-123000997.html?.tsrc=rss
2020-10-20	2020-10-20 16:31:04	ECL	Ecolab Inc.	Ecolab (ECL) Expected to Beat Earnings Estimates: What to Know Ahead of Q3 Release	Ecolab (ECL) possesses the right combination of the two key ingredients for a likely earnings beat in its upcoming report. Get prepared with the key expectations.	https://finance.yahoo.com/news/ecolab-ecl-expected-beat-earnings-163104459.html?.tsrc=rss
2020-10-17	2020-10-17 04:08:47	ECL	Ecolab Inc.	SPCM SA -- Moody's announces completion of a periodic review of ratings of SPCM SA	"Moody's Investors Service (""Moody's"") has completed a periodic review of the ratings of SPCM SA and other ratings that are associated with the same analytical unit.  The review was conducted through a portfolio review in which Moody's reassessed the appropriateness of the ratings in the context of the relevant principal methodology(ies), recent developments, and a comparison of the financial and operating profile to similarly rated peers.  Since 1 January 2019, Moody's practice has been to issue a press release following each periodic review to announce its completion."	https://finance.yahoo.com/news/spcm-sa-moodys-announces-completion-173006375.html?.tsrc=rss
